{
  "schema_version": "1.0.0",
  "project_id": "project-0baf89fc34ec72ba80627da6710182cb",
  "revision": 0,
  "mode": "standard",
  "engine": {
    "kind": "godot",
    "requested_version": "4.7.2-stable",
    "language": "gdscript"
  },
  "task_refs": [],
  "active_run_refs": [],
  "updated_at": "2026-08-26T01:54:32.063665Z"
}
